{
  "featureSnapshotId": "8ac01f7e-ead1-42c5-b5cd-95a0a5667f45",
  "submissionSnapshotId": "412c9288-2077-4710-a36a-576a78109f51",
  "financialStatementVersion": 1,
  "featureSchemaVersion": 2,
  "featureCodeDigest": "1a6fa666e304698553f127973b92dea52e2d19420965e103bba2363fe2f6c6f3",
  "featureAsOf": "2026-10-20T21:27:24.238063+00:00",
  "latestSourceAvailableAt": "2026-04-01T00:00:00Z",
  "financialSnapshotId": "e2483d19-8821-47a1-bb8b-d41062d26b2b",
  "financialSnapshotDigest": "6cb22bbd412a42f1b9f3e25a8c271ea450b20f76b6c0d9c8e2f2b3e3efcb89a4",
  "features": {
    "X1": 1.6679850862305663,
    "X2": 0.23815217512024506,
    "X3": 0.6084381035664695,
    "X4": 4.881695665005066,
    "X7": 2.1065733354806913,
    "X8": 3.1989958710017725,
    "X9": 5.75107501727612,
    "X10": 0.761847824879755
  },
  "missingFeatures": [],
  "snapshotDigest": "4d3ee90841b0dcdf56af97fd29049ac17330ce4001d1644010174bd1bbb031b6"
}
